<?xml version="1.0"?>
<model class-name="TestClass" namespace="PropBagLib.Tests" type-safety-mode="Loose" xmlns:xsi="http://www.w3.org/2001/XMLSchema-instance"
xsi:schemaLocation="https://www.swamphillproductions.com/PropBagModel ../PropBagModel/PropBagModel.xsd">
  <props>
    <prop use-reference-equality="false">
      <name>PropNullableInt</name>
      <type>Nullable&lt;int&gt;</type>
    </prop>
    <prop use-reference-equality="false">
      <name>PropICollectionInt</name>
      <type>ICollection&lt;int&gt;</type>
    </prop>
  </props>
</model>
