<?xml version="1.0"?>
<model
  class-name="TestExtStoreModel"
  output-namespace="PropBagLib.Tests"
  require-explicit-initial-value="false"
  xmlns:xsi="http://www.w3.org/2001/XMLSchema-instance"
  xmlns:xsd="http://www.w3.org/2001/XMLSchema"
  xsi:schemaLocation="https://www.swamphillproductions.com/PropBagModel ../../PropBagModel/PropBagModel.xsd">
  <namespaces>
    <namespace>System</namespace>
    <namespace>System.Collections.Generic</namespace>
    <namespace>PropBagLib.Tests</namespace>
  </namespaces>
  <props>
    <prop>
      <name>PropInt3</name>
      <type>int</type>
    </prop>
    <prop>
      <name>PropInt4</name>
      <type>int</type>
    </prop>
  </props>
</model>
